{
  "$schema": "https://json-schema.org/draft/2020-12/schema",
  "$id": "https://grandchallenge.ai/schemas/mathforge/openai_ten_proofs_permanent_full_formula_consequences_audit.schema.json",
  "title": "Permanent full formula consequences audit",
  "type": "object",
  "additionalProperties": false,
  "required": ["schema_version","record_type","operation_id","candidate_id","status","protected_predecessor","source_projection","lean_targets","structural_semantics","nonvacuity","exact_overlay_replay","coverage","candidate_disposition","claim_boundary"],
  "properties": {
    "schema_version": {"const":"1.0.0"},
    "record_type": {"const":"permanent_full_formula_consequences_audit"},
    "operation_id": {"const":"OTP-C-PERMANENT-FULL-FORMULA-CONSEQUENCES-001"},
    "candidate_id": {"const":"OPENAI-TEN-PROOFS-001"},
    "status": {"const":"FULL_FORMULA_SOURCE_CONSEQUENCES_CLEAR_CANDIDATE"},
    "protected_predecessor": {
      "type":"object","additionalProperties":false,
      "required":["semantic_merge","semantic_record_blob","source_commit","source_tree","source_archive_sha256","permanent_lean_sha256"],
      "properties":{
        "semantic_merge":{"const":"60f6e06c957139447bf5943eed731941b22ac608"},
        "semantic_record_blob":{"const":"3e04bd16bd8a91eaf9b6702de89fcdcc72f61099"},
        "source_commit":{"const":"e62211d28e3a9131950c89caa6542cfe5eff3bca"},
        "source_tree":{"const":"2f8e7ac5ae7f157b6b1de636c2c343b1c7a7e365"},
        "source_archive_sha256":{"const":"3022e62ffbed8f5f74d232034a703dc645e6b301879dff1e87df72979914294f"},
        "permanent_lean_sha256":{"const":"3bd469c20bc2277a13be3f9353ce47ad0c2070a330355daa78a9e59f1ca1d3c6"}
      }
    },
    "source_projection": {
      "type":"object","additionalProperties":false,
      "required":["coefficient_field","dimension_threshold","log_base","division_free","rational"],
      "properties":{
        "coefficient_field":{"const":"complex"},
        "dimension_threshold":{"const":32},
        "log_base":{"const":2},
        "division_free":{"$ref":"#/$defs/divisionFree"},
        "rational":{"$ref":"#/$defs/rational"}
      }
    },
    "lean_targets": {
      "type":"array","minItems":2,"maxItems":2,
      "prefixItems":[
        {"$ref":"#/$defs/divisionFreeTarget"},
        {"$ref":"#/$defs/rationalTarget"}
      ],
      "items":false
    },
    "structural_semantics": {
      "type":"object","additionalProperties":false,
      "required":["formula_measures_defined_in_protected_source","tree_identities_present","new_mathematical_proof_required","reason"],
      "properties":{
        "formula_measures_defined_in_protected_source":{"const":["variableLeaves","leafCount","internalGateCount","vertexCount"]},
        "tree_identities_present":{"const":["leafCount_eq_internalGateCount_add_one","vertexCount_eq_leafCount_add_internalGateCount"]},
        "new_mathematical_proof_required":{"const":false},
        "reason":{"type":"string","minLength":80}
      }
    },
    "nonvacuity": {
      "type":"object","additionalProperties":false,
      "required":["reused_from_protected_semantic_merge","division_free_witness","rational_witness","witness_blob"],
      "properties":{
        "reused_from_protected_semantic_merge":{"const":true},
        "division_free_witness":{"const":"PermanentFormulaLowerBound.Nonvacuity.permanent_divisionFree_formula_nonvacuous"},
        "rational_witness":{"const":"PermanentFormulaLowerBound.Nonvacuity.permanent_rational_formula_nonvacuous"},
        "witness_blob":{"const":"e756c8476bac1795f3fb8ca0b7235d3a4a5c59ea"}
      }
    },
    "exact_overlay_replay": {
      "type":"object","additionalProperties":false,
      "required":["run","job","lean_version","challenge_slot","ephemeral_overlay_only","immutable_archive_modified","lean_default_kernel","nanoda_kernel","comparator","axioms","marker"],
      "properties":{
        "run":{"const":31807864648},
        "job":{"const":94791029992},
        "lean_version":{"const":"4.32.0"},
        "challenge_slot":{"const":"ComparatorChallenges.C_PermanentFormulaLowerBound"},
        "ephemeral_overlay_only":{"const":true},
        "immutable_archive_modified":{"const":false},
        "lean_default_kernel":{"const":"accepted"},
        "nanoda_kernel":{"const":"accepted"},
        "comparator":{"const":"accepted"},
        "axioms":{"const":["propext","Classical.choice","Quot.sound"]},
        "marker":{"const":"PERMANENT_FULL_FORMULA_CONSEQUENCES_EXACT_OVERLAY_REPLAY_CLEAR"}
      }
    },
    "coverage": {
      "type":"object","additionalProperties":false,
      "required":["theorem_1_2_full_formula_consequences","theorem_1_3_full_formula_consequences","source_theorem_1_1_circuit_complexity","historical_pdf_byte_equivalence","solve_handoff_for_new_targets","mathcert_route_for_new_targets","adjudication","cert_output","mathematical_target_proved_promoted","aggregate_ten_proofs_authority"],
      "properties":{
        "theorem_1_2_full_formula_consequences":{"const":true},
        "theorem_1_3_full_formula_consequences":{"const":true},
        "source_theorem_1_1_circuit_complexity":{"const":false},
        "historical_pdf_byte_equivalence":{"const":false},
        "solve_handoff_for_new_targets":{"const":false},
        "mathcert_route_for_new_targets":{"const":false},
        "adjudication":{"const":false},
        "cert_output":{"const":false},
        "mathematical_target_proved_promoted":{"const":false},
        "aggregate_ten_proofs_authority":{"const":false}
      }
    },
    "candidate_disposition":{"const":"PERMANENT_FORMULA_FULL_SOURCE_CONSEQUENCES_CLEAR__128_256_192_384_AND_LEAF_VERTEX_BOUNDS_ENCODED__CIRCUIT_SEPARATE"},
    "claim_boundary":{"type":"string","minLength":450}
  },
  "$defs":{
    "divisionFree":{"type":"object","additionalProperties":false,"required":["source_theorem","variable_leaf_constant","leaf_count_constant","vertex_count_constant","internal_gate_constant"],"properties":{"source_theorem":{"const":"Theorem 1.2"},"variable_leaf_constant":{"const":128},"leaf_count_constant":{"const":128},"vertex_count_constant":{"const":128},"internal_gate_constant":{"const":256}}},
    "rational":{"type":"object","additionalProperties":false,"required":["source_theorem","variable_leaf_constant","leaf_count_constant","vertex_count_constant","internal_gate_constant"],"properties":{"source_theorem":{"const":"Theorem 1.3"},"variable_leaf_constant":{"const":192},"leaf_count_constant":{"const":192},"vertex_count_constant":{"const":192},"internal_gate_constant":{"const":384}}},
    "divisionFreeTarget":{"type":"object","additionalProperties":false,"required":["name","model","conclusions","source_classification"],"properties":{"name":{"const":"PermanentFormulaLowerBound.permanent_divisionFree_formula_lower_bound"},"model":{"const":"division_free_formula_tree"},"conclusions":{"const":["variableLeaves","leafCount","vertexCount","internalGateCount"]},"source_classification":{"const":"EXACT_FULL_FORMULA_CONSEQUENCE_MATCH"}}},
    "rationalTarget":{"type":"object","additionalProperties":false,"required":["name","model","conclusions","source_classification"],"properties":{"name":{"const":"PermanentFormulaLowerBound.permanent_rational_formula_lower_bound"},"model":{"const":"valid_rational_formula_tree"},"conclusions":{"const":["variableLeaves","leafCount","vertexCount","internalGateCount"]},"source_classification":{"const":"EXACT_FULL_FORMULA_CONSEQUENCE_MATCH"}}}
  }
}
